shared/results/test5/feature_error_summary.csv

feature,group,matched_pairs,mae,rmse,median_abs_error,max_abs_error,mean_relative_error,median_relative_error,mean_signed_error,mean_relative_error_pct
Fwd Act Data Pkts,altro,7,108.85714285714286,111.46299834474219,119.0,142.0,38.49092970521542,33.0,108.85714285714286,3849.092970521542
Fwd PSH Flags,TCP/flag/window,7,108.85714285714286,111.46299834474219,119.0,142.0,38.49092970521542,33.0,108.85714285714286,3849.092970521542
Bwd Header Length,dimensioni/lunghezze,7,3416.5714285714284,3510.2081338372436,2988.0,4600.0,29.819014402650055,28.904761904761905,3416.5714285714284,2981.9014402650055
Bwd Packets/s,conteggi pacchetti,7,108.5310764647752,211.39644375399953,2.29748023847838,500.8652947258767,20.43065802649107,17.60691770549874,108.5310764647752,2043.065802649107
Total Bwd packets,conteggi pacchetti,7,100.57142857142857,104.82093574963244,90.0,141.0,19.381519274376416,18.5,100.57142857142857,1938.1519274376415
PSH Flag Count,TCP/flag/window,7,99.57142857142857,102.4813571896302,86.0,138.0,18.10276967930029,16.0,99.57142857142857,1810.276967930029
Fwd Header Length,dimensioni/lunghezze,7,3527.4285714285716,3595.9949149813087,3548.0,4564.0,17.54161313235929,18.11111111111111,3527.4285714285716,1754.1613132359291
ACK Flag Count,TCP/flag/window,7,204.42857142857142,210.19684651705478,181.0,278.0,15.694186466857275,15.444444444444445,204.42857142857142,1569.4186466857275
Flow Packets/s,conteggi pacchetti,7,221.71974151376017,432.8880990792961,4.55130558370377,1028.8748135001786,14.97838762547043,16.276761166827814,221.71974151376017,1497.838762547043
Fwd Packets/s,conteggi pacchetti,7,113.18866504898496,221.50006479114836,2.2538253452253896,528.0095187743019,12.534325389513628,12.769230795710088,113.18866504898496,1253.4325389513629
Total Fwd Packet,conteggi pacchetti,7,104.85714285714286,107.00333773165343,98.0,138.0,11.63795518207283,11.5,104.85714285714286,1163.7955182072828
Total Length of Fwd Packet,conteggi pacchetti,7,22670.714285714286,26239.245522145422,27469.0,41008.0,10.25876355361534,11.556031406138473,22670.714285714286,1025.876355361534
Bwd Init Win Bytes,altro,7,35938.57142857143,35955.072958187295,35250.0,37720.0,4.936129754133668,4.304029304029304,35938.57142857143,493.61297541336677
Flow Bytes/s,throughput/rate,7,8929.454209374884,16131.31344109828,529.1306760550173,31213.122519723234,4.217336524577055,2.285735192353134,8873.170011991611,421.7336524577055
FWD Init Win Bytes,altro,7,34148.0,34148.0,34148.0,34148.0,4.16845703125,4.16845703125,34148.0,416.845703125
Subflow Bwd Packets,conteggi pacchetti,7,4.363408521303258,5.785795235303324,3.8421052631578947,11.907894736842106,2.060751879699248,1.5789473684210527,0.9611528822055136,206.0751879699248
Idle Max,durata/timing,7,27872766.85714286,39774142.989213504,25974974.0,91629941.0,1.0,1.0,-27872766.85714286,100.0
Idle Mean,durata/timing,7,18606170.083333336,24775225.92145716,20220506.0,52677604.5,1.0,1.0,-18606170.083333336,100.0
Idle Std,durata/timing,7,12620065.98503063,21750186.348543666,8234585.666057036,55086922.564420536,1.0,1.0,-12620065.98503063,100.0
Idle Min,durata/timing,7,7805903.571428572,9342205.746643448,10713382.0,13725268.0,1.0,1.0,-7805903.571428572,100.0
Active Max,durata/timing,7,966732.1428571428,1535958.8700399594,356343.0,3598937.0,1.0,1.0,-966732.1428571428,100.0
Active Mean,durata/timing,7,612524.3333333334,943998.0603508708,305839.0,2158502.0,1.0,1.0,-612524.3333333334,100.0
Active Std,durata/timing,7,445626.5680620993,810450.1732378945,105329.64360520735,2037082.712716889,1.0,1.0,-445626.5680620993,100.0
Active Min,durata/timing,7,251056.57142857142,362754.1797959447,229833.0,718067.0,1.0,1.0,-251056.57142857142,100.0
Total Length of Bwd Packet,conteggi pacchetti,7,8445.0,13344.334298013628,4202.0,32464.0,1.0,1.0,-8445.0,100.0
Subflow Bwd Bytes,conteggi pacchetti,7,2082.5714285714284,3426.634292046435,548.0,8116.0,1.0,1.0,-2082.5714285714284,100.0
Bwd Bulk Rate Avg,dimensioni/lunghezze,7,1937.4452219425834,5125.998236070417,0.0,13562.116553598084,1.0,1.0,-1937.4452219425834,100.0
Bwd Packet Length Max,conteggi pacchetti,7,1034.5714285714287,1128.668874635705,1353.0,1460.0,1.0,1.0,-1034.5714285714287,100.0
Bwd Bytes/Bulk Avg,dimensioni/lunghezze,7,823.9714285714286,2180.023487422621,0.0,5767.8,1.0,1.0,-823.9714285714286,100.0
Bwd Packet Length Mean,conteggi pacchetti,7,648.4674829931972,741.2150667881014,432.85333333333335,1158.3333333333333,1.0,1.0,-648.4674829931972,100.0
Bwd Segment Size Avg,dimensioni/lunghezze,7,648.4674829931972,741.2150667881014,432.85333333333335,1158.3333333333333,1.0,1.0,-648.4674829931972,100.0
Bwd Packet Length Std,conteggi pacchetti,7,443.00155305457974,470.8256071867703,449.34269454710966,705.3422337182616,1.0,1.0,-443.00155305457974,100.0
Bwd Act Data Pkts,altro,7,11.428571428571429,20.577380091463816,4.0,53.0,1.0,1.0,-11.428571428571429,100.0
Bwd PSH Flags,TCP/flag/window,7,9.285714285714286,15.797829869049375,4.0,40.0,1.0,1.0,-9.285714285714286,100.0
SYN Flag Count,TCP/flag/window,7,2.0,2.0,2.0,2.0,1.0,1.0,2.0,100.0
FIN Flag Count,TCP/flag/window,7,1.4285714285714286,2.2677868380553634,0.0,4.0,1.0,1.0,0.8571428571428571,100.0
Bwd Packet/Bulk Avg,conteggi pacchetti,7,1.2857142857142858,3.401680257083045,0.0,9.0,1.0,1.0,-1.2857142857142858,100.0
Fwd IAT Min,durata/timing,7,434.14285714285717,457.1834580184571,370.0,762.0,0.9975199207804412,0.9973045822102425,-434.14285714285717,99.75199207804411
Fwd Packet Length Max,conteggi pacchetti,7,736.1428571428571,846.1203055290491,662.0,1211.0,0.9686838695454888,0.7823383084577115,686.7142857142857,96.86838695454888
Fwd IAT Mean,durata/timing,7,3197374.2540482813,3939152.702745002,3340712.2501122584,6696980.370103917,0.9175176451186795,0.9329797297586598,-3197374.2540482813,91.75176451186795
Flow IAT Mean,durata/timing,7,1918849.4983964188,2465497.1789374948,2251577.550250516,4364150.401495616,0.9172087317714792,0.944980531678517,-1918849.4983964188,91.72087317714792
Flow IAT Std,durata/timing,7,5209926.498157108,6201262.820817053,6615798.467343664,8732163.706905266,0.9130681679868218,0.9117255648968193,-5209926.498157108,91.30681679868218
Bwd IAT Mean,durata/timing,7,6167691.787904964,8274770.178574792,7563359.229651162,15514732.173357664,0.9126611463270441,0.9438903736008364,-6167691.787904964,91.26611463270442
Fwd IAT Std,durata/timing,7,6919062.789227238,8500468.245826486,7838155.7581462115,14953019.644982707,0.9099022816336617,0.9074205292464576,-6919062.789227238,90.99022816336617
Bwd IAT Std,durata/timing,7,7346155.607974012,8714376.261484366,9671415.23928095,11661759.013987515,0.9094316436380172,0.9025454534294116,-7344736.503376988,90.94316436380171
Fwd IAT Max,durata/timing,7,25757229.85714286,37680673.482970595,22949869.0,88604649.0,0.9012459511848815,0.8837893154538947,-25757229.85714286,90.12459511848814
Flow IAT Max,durata/timing,7,25746942.714285713,37680686.288261585,22950138.0,88604712.0,0.8985548597532294,0.8837910422858158,-25746942.714285713,89.85548597532294
Bwd IAT Max,durata/timing,7,25865217.57142857,37769086.9357092,23169273.0,88624428.0,0.8815753154893295,0.8845159986172562,-25865217.57142857,88.15753154893295
Bwd IAT Min,durata/timing,7,27643.85714285714,42289.3633080471,19848.0,80436.0,0.8567570370556375,0.9999498671479421,-27643.85714285714,85.67570370556375
Flow IAT Min,durata/timing,7,48.857142857142854,63.727096726140424,53.0,131.0,0.845120369728014,0.9824561403508771,-48.857142857142854,84.5120369728014
Bwd IAT Total,durata/timing,7,11492951.285714285,21477696.73674264,5690036.0,55460273.0,0.8410261601572363,0.1103438907354521,-11389129.57142857,84.10261601572363
Packet Length Max,conteggi pacchetti,7,857.7142857142857,874.0317091338441,927.0,1088.0,0.8098997342825863,0.6832167832167833,294.85714285714283,80.98997342825864
Down/Up Ratio,altro,7,0.5117205418752867,0.6056220987958126,0.48,1.2210338680926918,0.7302195172230015,0.9166666666666667,0.14891644019026679,73.02195172230014
Average Packet Size,conteggi pacchetti,7,305.29936517621593,342.8739869182398,290.6637719728272,544.7875,0.7156831476030128,0.6724450339043208,-305.29936517621593,71.56831476030128
Packet Length Mean,conteggi pacchetti,7,305.2993651762159,342.8739869182397,290.6637719728271,544.7875,0.7156831476030128,0.6724450339043208,-305.2993651762159,71.56831476030128
Subflow Fwd Bytes,conteggi pacchetti,7,487.8928571428573,681.0410221682891,341.4912280701751,1185.4035087719305,0.7060290908441355,0.43359095331632197,357.2901002506268,70.60290908441354
Subflow Fwd Packets,conteggi pacchetti,7,1.81328320802005,2.5395196752840175,1.2631578947368425,4.894736842105263,0.6996904024767803,0.3157894736842106,1.3696741854636592,69.96904024767802
Packet Length Variance,conteggi pacchetti,7,183092.11811142648,233356.68911392582,122617.4175734391,471681.74130727764,0.6783856667047221,0.5803355980610123,-183092.11811142648,67.8385666704722
Fwd Seg Size Min,altro,7,12.0,12.0,12.0,12.0,0.6,0.6,12.0,60.0
Packet Length Std,conteggi pacchetti,7,254.90790297380445,313.9033354021376,136.8899376762502,585.9655469719781,0.49212557062390083,0.35218490142712183,-254.90790297380445,49.21255706239008
Fwd Packet Length Std,conteggi pacchetti,7,78.35535878277463,101.69987844974213,71.2333082923609,190.89778424124108,0.22322298034589452,0.2023217115291067,-70.72742689668858,22.32229803458945
Fwd IAT Total,durata/timing,7,11577837.142857144,21522407.30263391,5942737.0,55478781.0,0.13825338319264135,0.09280576390058946,-11572474.857142856,13.825338319264135
Flow Duration,durata/timing,7,11577786.57142857,21522369.48465909,5942659.0,55478711.0,0.13825266490789365,0.09280454580031273,-11572424.285714285,13.825266490789364
Total Connection Flow Time,altro,7,11577786.57142857,21522369.48465909,5942659.0,55478711.0,0.13825266490789365,0.09280454580031273,-11572424.285714285,13.825266490789364
Fwd Packet Length Mean,conteggi pacchetti,7,30.525326117882493,43.415032348482946,28.928571428571388,97.38888888888908,0.12456101900729251,0.08952912452040439,-21.059135641692045,12.456101900729251
Fwd Segment Size Avg,dimensioni/lunghezze,7,30.525326117882486,43.4150323484829,28.928571428571445,97.38888888888891,0.12456101900729248,0.08952912452040454,-21.05913564169202,12.456101900729248
ICMP Code,altro,7,0.0,0.0,0.0,0.0,0.0,0.0,0.0,0.0
ICMP Type,altro,7,0.0,0.0,0.0,0.0,0.0,0.0,0.0,0.0
Protocol,identita/topologia,7,0.0,0.0,0.0,0.0,0.0,0.0,0.0,0.0
Fwd Bulk Rate Avg,dimensioni/lunghezze,7,50796.422862753294,55881.19670842804,53135.67903314722,89057.14426572356,,,50796.422862753294,
Fwd Bytes/Bulk Avg,dimensioni/lunghezze,7,4501.226870748299,6035.701424297404,2451.5714285714284,11690.0,,,4501.226870748299,
Total TCP Retrans. Count,TCP/flag/window,7,116.57142857142857,119.06900760243435,130.0,148.0,,,116.57142857142857,
Fwd TCP Retrans. Count,TCP/flag/window,7,58.42857142857143,59.6381948562688,65.0,74.0,,,58.42857142857143,
Bwd TCP Retrans. Count,TCP/flag/window,7,58.142857142857146,59.431833701669156,65.0,74.0,,,58.142857142857146,
Fwd Packet/Bulk Avg,conteggi pacchetti,7,28.85595238095238,43.99435851730545,8.625,88.0,,,28.85595238095238,
Bwd Packet Length Min,conteggi pacchetti,7,0.0,0.0,0.0,0.0,,,0.0,
Bwd RST Flags,TCP/flag/window,7,0.0,0.0,0.0,0.0,,,0.0,
Bwd Seg Size Min,altro,7,0.0,0.0,0.0,0.0,,,0.0,
Bwd URG Flags,TCP/flag/window,7,0.0,0.0,0.0,0.0,,,0.0,
CWR Flag Count,TCP/flag/window,7,0.0,0.0,0.0,0.0,,,0.0,
ECE Flag Count,TCP/flag/window,7,0.0,0.0,0.0,0.0,,,0.0,
Fwd Packet Length Min,conteggi pacchetti,7,0.0,0.0,0.0,0.0,,,0.0,
Fwd RST Flags,TCP/flag/window,7,0.0,0.0,0.0,0.0,,,0.0,
Fwd URG Flags,TCP/flag/window,7,0.0,0.0,0.0,0.0,,,0.0,
Packet Length Min,conteggi pacchetti,7,0.0,0.0,0.0,0.0,,,0.0,
RST Flag Count,TCP/flag/window,7,0.0,0.0,0.0,0.0,,,0.0,
URG Flag Count,TCP/flag/window,7,0.0,0.0,0.0,0.0,,,0.0,

shared/results/test5/suggestions.md

## Feature peggiori

- Fwd Act Data Pkts (altro): errore relativo medio 3849.09%, sovrastima.
- Fwd PSH Flags (TCP/flag/window): errore relativo medio 3849.09%, sovrastima.
- Bwd Header Length (dimensioni/lunghezze): errore relativo medio 2981.90%, sovrastima.
- Bwd Packets/s (conteggi pacchetti): errore relativo medio 2043.07%, sovrastima.
- Total Bwd packets (conteggi pacchetti): errore relativo medio 1938.15%, sovrastima.
- PSH Flag Count (TCP/flag/window): errore relativo medio 1810.28%, sovrastima.
- Fwd Header Length (dimensioni/lunghezze): errore relativo medio 1754.16%, sovrastima.
- ACK Flag Count (TCP/flag/window): errore relativo medio 1569.42%, sovrastima.
- Flow Packets/s (conteggi pacchetti): errore relativo medio 1497.84%, sovrastima.
- Fwd Packets/s (conteggi pacchetti): errore relativo medio 1253.43%, sovrastima.